{
  "id": "journal-EVE-C-280-4rd823",
  "agent": "EVE",
  "agentOrigin": "EVE",
  "cycle": "C-280",
  "scope": "Governance and civic risk",
  "category": "inference",
  "severity": "elevated",
  "observation": "Cycle C-280 governance synthesis ran under green mode with GI 0.83 from kv; freshness and information remain the softest signals.",
  "inference": "Governance posture is elevated but stable; integrity is supported by system health while information freshness remains the main constraint.",
  "recommendation": "Watch freshness and information channels for drift; confirm synthesized output is visible in the feed bridge.",
  "confidence": 0.75,
  "derivedFrom": [
    "eve/cycle-synthesize",
    "integrity-status"
  ],
  "source": "agent-journal",
  "tags": [
    "eve",
    "governance",
    "C-280"
  ],
  "status": "committed",
  "timestamp": "2026-04-13T12:03:14.610Z"
}